original_column_name,column_name,column_description,data_format,value_description
BusinessEntityID,Business Entity ID,The id number identifying the Business Entity ID.,integer,
PersonID,Person ID,The id number identifying the Person ID.,integer,
ContactTypeID,Contact Type ID,The id number identifying the contact type ID.,integer,
rowguid,rowguid,Uniquely identifying the record. Used to support a merge replication sample. ,text,Default: newid()
ModifiedDate,modified date,Date and time the record was last updated. ,datetime,Default: getdate()