original_column_name,column_name,column_description,data_format,value_description
ProductSubcategoryID,Product Subcategory ID,Unique id number identifying the subcategory of products.,integer,
ProductCategoryID,Product Category ID,Product category identification number.,integer,
Name,,Subcategory description.,text,
rowguid,rowguid,Uniquely identifying the record. Used to support a merge replication sample. ,text,Default: newid()
ModifiedDate,modified date,Date and time the record was last updated. ,datetime,Default: getdate()