original_column_name,column_name,column_description,data_format,value_description
BusinessEntityID,Business Entity ID,The sales representative.,integer,
TerritoryID,Territory ID,Territory identification number.,integer,
StartDate,Start Date,Date the sales representive started work in the territory.,datetime,
EndDate,End Date,Date the sales representative left work in the territory.,datetime,
rowguid,rowguid,Uniquely identifying the record. Used to support a merge replication sample. ,text,Default: newid()
ModifiedDate,modified date,Date and time the record was last updated. ,datetime,Default: getdate()